{
  "proposal_id": "proposal-state-001",
  "proposal_type": "state_update",
  "target_layer": "state",
  "target_artifact_id": "current-planning",
  "target_file": "state/current-planning.json",
  "operation": "structured_merge",
  "proposed_content": {
    "item": "Prepare a synthetic portfolio outline.",
    "next_action": "Choose three public-safe sample artifacts.",
    "status": "active"
  },
  "rationale": "This is an active, time-bounded planning item rather than durable context.",
  "source_context_summary": "A synthetic planning exercise established a near-term action and review date.",
  "privacy_risk": "low",
  "durability": "transient",
  "review_by": "human_owner",
  "review_required": true,
  "requires_explicit_approval": true,
  "approval_status": "applied",
  "approval": {
    "approval_id": "approval-state-001",
    "approved_by": "human_owner",
    "approved_at": "2026-07-01T14:20:00Z",
    "content_digest": "sha256:aaaaaaaaaaaaaaaaaaaaaaaaaaaaaaaaaaaaaaaaaaaaaaaaaaaaaaaaaaaaaaaa",
    "target_artifact_id": "current-planning"
  },
  "created_at": "2026-07-01T14:05:00Z",
  "state_category": "active_plan",
  "stale_after": "2026-07-15",
  "review_trigger": "Review when the outline is completed or the stale-after date is reached.",
  "status": "active",
  "priority": "medium"
}
