{
  "proposal_id": "proposal-memory-001",
  "proposal_type": "memory_update",
  "target_layer": "memory",
  "target_artifact_id": "communication-preferences",
  "target_file": "memory/communication-preferences.md",
  "operation": "append",
  "proposed_content": {
    "entry": "The user prefers recommendations that state the decision first and supporting detail second."
  },
  "rationale": "The preference is reusable across future planning and writing sessions.",
  "source_context_summary": "A synthetic series of practice sessions showed the same stable formatting preference.",
  "privacy_risk": "low",
  "durability": "durable",
  "review_by": "human_owner",
  "review_required": true,
  "requires_explicit_approval": true,
  "approval_status": "pending_review",
  "approval": null,
  "created_at": "2026-07-01T14:00:00Z",
  "memory_category": "communication_preference",
  "reason_this_is_durable": "It describes a recurring preference that remains useful after any single session ends.",
  "replacement_or_append": "append"
}
